"Reviewer and Date","Reviewer","Date","Rating","Description"
"Cucu Ridwan 31 Januari 2021 	","Cucu Ridwan","31 Januari 2021","Diberi rating 5 bintang dari 5 bintang","Alhamdulillah ada aplikasi ini..memudahkan saat sakit dan butuh obat tanpa keluar rumah disaat wabah covid ...terima kasih banyak halodoc..."
"Nia Priyana 23 Maret 2021 	","Nia Priyana","23 Maret 2021","Diberi rating 5 bintang dari 5 bintang","Senang deh, adanya aplikasi kayak gini bisa mempermudah untuk tetap sehat, karena bisa konsultasi online disaat kondisi lg pandemi gini"
"mentari indah saputri 27 Januari 2021 	","mentari indah saputri","27 Januari 2021","Diberi rating 1 bintang dari 5 bintang","Error loading message terus .. mau masuk gopay juga gagal mulu .. tak kira internet ku ternyata aplikasinya.. aku buka aplikasi lainnya aman aman aja.."
"Wahyu Kurniawan 6 April 2021 	","Wahyu Kurniawan","6 April 2021","Diberi rating 5 bintang dari 5 bintang","Selalu ingin berpartisipasi dalam penanggulangan covid 19"
"watch kingdom indonesia 3 Februari 2021 	","watch kingdom indonesia","3 Februari 2021","Diberi rating 5 bintang dari 5 bintang","Dr specialis kulit Regitta sngat ramah, sarannya bgus. Resepnya manjur , Stiap pertanyaan di jawab dengan jelas, sbar ,balas chat tidak singkat2, dan tidak tergesa2, prnah konsul di DR special kulit lain maaf ada yg jawabnya singkat2, dan tidak di kasih penjelasan.yg detail, pkoknya DR regitta recomended banget. Trimakasi"
"Hafiz m 16 Maret 2021 	","Hafiz m","16 Maret 2021","Diberi rating 4 bintang dari 5 bintang","maaf mau tanya,,, untuk rapid antigen yg di Kemayoran,,untuk metode pembayaran bisa pake ATM BRI ngga?TRIms"
"komar udin 30 Maret 2021 	","komar udin","30 Maret 2021","Diberi rating 5 bintang dari 5 bintang","Semoga anak saya cocok dengan obat yg dokter anak resepkan"
"Dessy Syani 8 Maret 2021 	","Dessy Syani","8 Maret 2021","Diberi rating 5 bintang dari 5 bintang","Sangat beruntung punya aplikasi Halodoc, krna gak perlu antri2 lagi di RS atau klinik. Dan obat2 nya juga yg di rekomendasikan bener2 manjur."
"PN official Channel 27 Januari 2021 	","PN official Channel","27 Januari 2021","Diberi rating 5 bintang dari 5 bintang","Halodoc , terimakasih ya atas artikel di google , berkat halodoc bisul di telinga saya jadi kempes dan normal sprti awal , terimakasih halodoc semoga kedepannya lebih baik dari sebelumnya"
"SHEZA MAYSOON 17 Maret 2021 	","SHEZA MAYSOON","17 Maret 2021","Diberi rating 5 bintang dari 5 bintang","Sangat membantu dan bermanfaat disaat pandemi seperti ini. Obat yang dianjurkan sangat baik dan cepat menyembuhkan sesuai penyakit. Tepat sasaran. Terima kasih"
"Mas_Arif80 7 April 2021 	","Mas_Arif80","7 April 2021","Diberi rating 3 bintang dari 5 bintang","Sudah vaksin tapi belum keluar sertifikat vaksinnya kenapa ya min"
"Maz Byantoro 1 Februari 2021 	","Maz Byantoro","1 Februari 2021","Diberi rating 5 bintang dari 5 bintang","Konsultasi dgn dokterya ramah, informatif dan komunikatif. Chat jam 02.00 dinihari pun ada yg menjawab. Apps yg sangat membantu.."
"Wenny Andiani 29 Januari 2021 	","Wenny Andiani","29 Januari 2021","Diberi rating 1 bintang dari 5 bintang","Maaf saya kasih bintang 1 karna sudah berkali-kali saya coba utk transaksi (menyambungkan via gojek dan kartu debit) tp selalu gagal. Dan saya tidak tau bagaimana solusinya"
"Lucky Person 8 Maret 2021 	","Lucky Person","8 Maret 2021","Diberi rating 5 bintang dari 5 bintang","Waw. Dokter nya ramah. Diskusi enak n lancar...salut. ngak sangka bagus sekali. Ngak sampai 2 jam obat sudah ditangan......"
"irwan djtmk 6 Februari 2021 	","irwan djtmk","6 Februari 2021","Diberi rating 5 bintang dari 5 bintang","Saat bingung menghadapi penyakit, aplikasi ini salah satu aplikasi yang dapat membantu mendapatkan solusi ataupun jawaban serta langkah yang harus dilakukan."
"Adelaide Th. M. PolkesJasa 5 Februari 2021 	","Adelaide Th. M. PolkesJasa","5 Februari 2021","Diberi rating 5 bintang dari 5 bintang","Dokter²nya sangat responsif dan sangat jelas menerangkan pertanyaan² dari keluhan yg disampaikan. Juga memberikan saran² utk kebaikan pasien. Trimakasih halodoc 😍😚"
"Luminta Motor 30 Maret 2021 	","Luminta Motor","30 Maret 2021","Diberi rating 5 bintang dari 5 bintang","Sangat membantu dengan cepat kebutuhan obat obatan dan konsultasi kesehatan"
"Lestari Hastuti 5 April 2021 	","Lestari Hastuti","5 April 2021","Diberi rating 5 bintang dari 5 bintang","Selamat pagi sertifikat tidak bisa dibuka pada vaksin 1"
"M RS 29 Maret 2021 	","M RS","29 Maret 2021","Diberi rating 5 bintang dari 5 bintang","Sangat membantu sekali ya Di tengah pandemi seperti ini"
"Bapaknya janda 6 April 2021 	","Bapaknya janda","6 April 2021","Diberi rating 3 bintang dari 5 bintang","Baru minta chat ga d bls sm dokternya eh saldo tetap di kurang in.. Dodol. Emang"
"Tom G 13 Maret 2021 	","Tom G","13 Maret 2021","Diberi rating 4 bintang dari 5 bintang","Semua berbayar ga ada yg gratis, sy cuma mau nanya obat batuk pilek yg terbaik yg dijual di warung, karna nggak paham perbedaan masing"" obat Tp lumayan lah app nya bisa liat dokter yg cantik dengan pengalamannya dan tau dia lulusan mana 😁 Saya rasa bintang 4 sudah sangat pas untuk app ini"
"Juvenus Matahari 13 Maret 2021 	","Juvenus Matahari","13 Maret 2021","Diberi rating 5 bintang dari 5 bintang","Ngapain harus ngantri ke klinik atau rumah sakit atau ke dokter, mending Halodoc aja. Tinggal klik konsultasi keluhan, tunggu obat, beres... Halodoc, keren, terimakasih kasih, Halodoc"
"Fitri Hasanah 2 Februari 2021 	","Fitri Hasanah","2 Februari 2021","Diberi rating 4 bintang dari 5 bintang","Bagus tpi saat kita pesan tdk klik nama apotik, di ksh nya jarak yg jauh ksian grab/gojek nya yg anterin, lain kali bisa di lihat dri mana apotik berasal."
"achmad kailani 22 Februari 2021 	","achmad kailani","22 Februari 2021","Diberi rating 5 bintang dari 5 bintang","Ini baru pertama kali menggunakan aplikasi halodoc, terutama saat konsultasi dengan dokter. sangat bermanfaat sekali saat kondisi seperti ini, tapi harus benar2 menjelaskan keluhannya agar tidak salah diagnosa."
"Daniek K Tyas 1 Februari 2021 	","Daniek K Tyas","1 Februari 2021","Diberi rating 5 bintang dari 5 bintang","Baru download app langsung suka sama menunya, apa lagi bisa chat langsung dg Dr. Yang kita mau.. Fast respon pula. Thanks Halodoc"
"derira fanela 27 Februari 2021 	","derira fanela","27 Februari 2021","Diberi rating 5 bintang dari 5 bintang","Terima kasih hallo doc...di saat pandemi paling aman kesini...saya selalu konsul dengan dokter senior yang sudah menjadi langganan kami selama 1 tahun ini...terima kasih banyak"
"Azzahra Adjeng 28 Maret 2021 	","Azzahra Adjeng","28 Maret 2021","Diberi rating 5 bintang dari 5 bintang","Terimakasih halodoc saya komplain dan cs nya cepat menanggapi 🙏"
"naycilla cilla 14 Maret 2021 	","naycilla cilla","14 Maret 2021","Diberi rating 5 bintang dari 5 bintang","Sangat membantu saat kondisi seperti ini tanpa hrs dtng k rumah sakit pasien aman sehat t jaga.terima kasih hallo doc pertahankan respon cepat dengan dokter"
"Rani Arkan 22 Maret 2021 	","Rani Arkan","22 Maret 2021","Diberi rating 1 bintang dari 5 bintang","Mau konsultasi aja harus pake bayar segala,kalo kaya gitu mending langsung ke RS aja,bisa langsung di kasih obatnya,bukanya membantu inimah"
"Kaka Im 7 April 2021 	","Kaka Im","7 April 2021","Diberi rating 1 bintang dari 5 bintang","Aplikasinya gak jalan.gak merespon. Menyebalkan."
"Dhita Novilia 2 April 2021 	","Dhita Novilia","2 April 2021","Diberi rating 5 bintang dari 5 bintang","sangat terbantu di masa pandemi gini buat yg masi parno ke rs"
"Atikah Wati 7 April 2021 	","Atikah Wati","7 April 2021","Diberi rating 5 bintang dari 5 bintang","bagus banget aplikasi nya dan respon dokternya pun baik"
"Novia Fakhrie 7 April 2021 	","Novia Fakhrie","7 April 2021","Diberi rating 5 bintang dari 5 bintang","Sangat membantu,cepat praktis. Sanngat memuaskan"
"Ayu Agni 12 Februari 2021 	","Ayu Agni","12 Februari 2021","Diberi rating 5 bintang dari 5 bintang","Thanks Halodoc.. Bener-bener ngebantu disaat urgent seperti long weekend sekarang Thanks buat dokter yang stand by walaupun weekend, chat nya juga asik dan ramah, info yang diberikan juga akurat banget"
"Mega Bekti Suryana 21 Maret 2021 	","Mega Bekti Suryana","21 Maret 2021","Diberi rating 5 bintang dari 5 bintang","Terimakasih dengan adanya app halodoc saya lebih mudah konsul dengan dokter. Semoga sakit yang ada pada diri saya, segera sembuh. Amin"
"Shinta Ocean 13 Maret 2021 	","Shinta Ocean","13 Maret 2021","Diberi rating 5 bintang dari 5 bintang","Bisa membantu waktu saya sakit maag di kosan dan tidak bisa berjalan ke apotik lalu saya pesan via halodoc by gojek. Puji Tuhan langsung saya minum obat nya dan sembuh. Untung ada halodoc 😍🤗"
"Amanandya rizki 7 Februari 2021 	","Amanandya rizki","7 Februari 2021","Diberi rating 5 bintang dari 5 bintang","terimakasih banyak, melayani 24jam dan konsultasi nya bagus ramah2 dokternya.. pagi2 subuh konsul jg ada dokternya uhuhu makasiiih beneran, konsul nya jg murah krn ada diskon voucher, semoga pelayanannya selalu meningkat yaa"
