rating,review,aspect_category,polarity,word_count,avg_word
3,bantu kondisi pandemi tolong evaluasi dian obat apotek rekan kota manado resep obat batuk apotek suka habis sia sia konsultasi dokter ujung ujung obat resep apotek rugi chat mahal biaya masuk baik pakai fitur chat us customer pelayanan customer pelayanan ubah produk obat saran konsultasi dokter,pelayanan,negatif,44,7.782608695652174
5,konsultasi dokter bagus durasi cepat dokter dokter chat bantu terima kasih,pelayanan,negatif,10,8.4
1,astaga obat beli obat harga masuk akal lipat ulang chat bantu coba bayar resep bank beda obat gagal solusi penyelesain ulang gagal harga obat masuk akal semoga baik banding saing,harga,negatif,30,7.466666666666668
5,terima kasih layan baik cepat kirim bantu jelek nambahkan layan kirim obat baik terimakasih,pelayanan,positif,13,8.5
1,telepon nomor hadiah konfirmasi aplikasi hadiah email nomor telepon genggam,sistem,positif,10,8.909090909090908
5,sumpah alternatif miris uang sakit hemat pakai aplikasi bagus kerja cocok anak kosan,harga,positif,14,8.142857142857142
1,konfirmasi customer pelayanan selesai komunikasi ulang kasih bukti ampun ampun munculin aplikasi,pelayanan,negatif,13,8.133333333333333
5,bantu darurat rumah anak tetiba anak sakit obat habis pesan harga obat bagus cari murah terima kasih,harga,positif,16,7.0
4,suka suka aplikasi beda aplikasi belah jelas rekomendasi obat dokter kesel konsultasi dokter ganti dokter saldo mohon perhati dokter sibuk aktivitas nyala konsultasi jelek darurat,pelayanan,negatif,30,9.333333333333334
5,bantu konsultasi whatsapp pandemi chat respon plus perihal bantu terima kasih,pelayanan,positif,11,8.636363636363637
1,telepon nama aneh telepon email bilang uang juta rupiah aplikasi privasi email ambil untung tipu tolong privasi ketat,sistem,negatif,19,8.578947368421053
5,keren cepat bagus bantu jelek rumah cek sehat aman pandemi covid,anekdot/serbaneka,positif,12,7.75
5,bantu jam anak sakit konsultasi dokter terima kasih adi suryadinata bantu,pelayanan,positif,11,8.272727272727273
5,bantu mudah cari obat obat respon cepat pesan terima kasih,pelayanan,positif,9,8.1
1,pulang hapus aplikasi kecewa profesional chat customer terima kasih,pelayanan,negatif,10,7.909090909090909
2,konsultasi bayar pakai gagal terang dana konsultasi coba malas tolong sistem bayar baik,sistem,negatif,14,9.642857142857142
5,bantu pergi rumah sakit antre aplikasi bantu praktis takut langsung konsultasi dokter kasi resep makas,anekdot/serbaneka,positif,16,8.352941176470589
1,ralat bayar aplikasi bantu,sistem,negatif,5,9.2
1,jujur puas nasihat nasihat jelas dokter sayang konsultasi aplikasi menit otomatis henti,pelayanan,negatif,12,9.416666666666666
5,bantu obat cari apotek kosong lengkap pakai mudah terimakasih,pelayanan,positif,10,8.7
5,aplikasi bantu sehat produk sehat aplikasi konsultasi sakit beli obat obat produk sehat aplikasi pilih langsung konek akun gojek terima kasih layan sukses bagus,anekdot/serbaneka,positif,23,8.708333333333334
1,tolong evaluasi respon email chat transaksi beli gopay kurir kecewa dana,pelayanan,negatif,12,8.23076923076923
5,aplikasi bagus saran adakan opsi bayar gerai kaya alfamart indomart bantu remaja orang orang milik gopay debit,anekdot/serbaneka,positif,18,7.894736842105262
5,bagus aplikasi ketemu bagus respon dokter cepat bagus tahan bantu bagus,anekdot/serbaneka,positif,12,7.6923076923076925
5,aplikasi nomor sulit bantu keliling apotek obat obat jarang sedia apotek konsultasi dokter mudah layan ramah,pelayanan,positif,16,8.5625
5,bantu aplikas khawatir dadak malam butuh obat bantu,pelayanan,positif,8,8.625
5,sangan bantu isoman beli obat cegah tular virus orang bantu,pelayanan,positif,10,8.3
5,daftar masuk email nomor telepon masuk menunggu,sistem,negatif,7,7.857142857142858
5,bantu orang malas rumah menunggu antre dokter bagus layan cepat resep akurat,pelayanan,positif,12,7.833333333333332
5,coba bantu pandemi covid rumah diagnosis beli obat,pelayanan,positif,8,7.75
5,mudah antre rumah sakit konsultasi aplikasi obat rumah bantu,pelayanan,positif,10,8.7
5,bagus bantu pandemi bantu dokter spesialis juara juara semoga tahan bagus bantu,pelayanan,positif,12,8.416666666666666
5,admin suntik vaksin dosis tanggal tanggal teman sms suntik vaksin dosis admin mohon pencerahanya,anekdot/serbaneka,positif,14,7.928571428571429
5,konsultasi antisipasi rumah bantu terima kasih sedia aplikasi,pelayanan,positif,8,9.875
5,bantu aplikasi kemarin cari resep dokter putar putar apotek ketemu aplikasi bantu capai capai putar putar,pelayanan,positif,17,8.117647058823529
3,umur uang konsultasi dokter konsultasi bayar solosi it tolong,anekdot/serbaneka,positif,9,7.888888888888888
5,aplikasi bagus chat psikiatris mudah daring dokter ramah hakim erti terima kasih,pelayanan,positif,13,8.461538461538463
5,terima kasih manfaat aplikasi konsultasi dokter mudah,anekdot/serbaneka,positif,6,8.857142857142858
5,bagus vaksin kendala efek samping jelek timbul ngantuk vaksin,anekdot/serbaneka,positif,9,8.333333333333334
5,cepat kirim kilat harga obat obat beda apotek langsung bangga,pelayanan,positif,10,8.6
1,aplikasi jelek pesan apotek obat suruh batal batal telepon customer pelayanan batalin jam batalin batal saldo kerja,pelayanan,negatif,17,8.38888888888889
5,bagus konsultasi dokter rumah sakit khawatir kena covid murah harga konsultasi,harga,positif,11,8.181818181818182
3,layan cepat aneh bayar pakai kartu kredit kartu sedia available,sistem,negatif,10,8.8
2,aplikasi lambat coba uninstal telepon genggam aplikasi berat telepon genggam jalan gabagus,sistem,negatif,10,8.25
5,dokter hebat hebat jelas fokus keluh derita terima kasih,pelayanan,positif,9,7.5555555555555545
5,efektif murah bagus,harga,positif,3,7.666666666666668
5,bagus bantu dokter dokter bagus layan sehat agam,pelayanan,positif,8,8.625
5,respon keluh team customer pelayanan respon ulas update respon team customer pelayanan cepat,pelayanan,positif,11,7.846153846153847
5,bantu konsultasi dokter langsung repot rumah sakit faskes terima kasih,pelayanan,positif,10,8.4
1,telepon agen nomor rekening,anekdot/serbaneka,positif,4,8.25
1,bintang kode voucher vaksinasi kasih bintang,pelayanan,negatif,6,8.5
5,bagus dokter responsif lumayan bagus ajak diskusi logis analisis gugup gugup dokter ketemu senang,pelayanan,positif,14,8.142857142857142
5,bagus antre sakit chat langsung bales obat terima kasih holodocbantu,pelayanan,positif,11,8.181818181818182
5,puas konsultasi pandemi dokter ramah,pelayanan,positif,5,8.4
4,muas balas cepat pilih dokter resep obat mahal semoga cocok,harga,positif,10,8.2
3,selamat sore admin aplikasi kerjasama medicilin mohon admin terima kasih,anekdot/serbaneka,positif,10,8.3
5,bantu darurat langsung tindak dokter ramah terima kasih,anekdot/serbaneka,positif,8,8.555555555555555
4,konsultasi putri farisa konsultasi selesai resep obat terima kasih,pelayanan,positif,9,8.444444444444445
5,suka menu konsultasi dokter mudah cari informasi sehat tubuh,pelayanan,positif,9,9.111111111111109
4,aplikasi bantus ramah ramah profesional sukses,pelayanan,positif,6,8.833333333333334
5,bantu posisi kota kondisi badan fit susah cari dokter butuh obat sesuai dosis bantu aplikasi terima kasih bagus,anekdot/serbaneka,positif,18,7.473684210526316
5,bantu bantu dokter konsultasi,pelayanan,positif,4,10.0
5,coba gomed cepat respon kirim tingkat,pelayanan,positif,6,8.666666666666666
5,bagus konsultasi psikologi baik,anekdot/serbaneka,positif,4,9.0
5,dokter bagus jelas detail saran saran obat resep bagus,pelayanan,positif,9,7.666666666666668
5,layan baik konsultasi bagus puas terima kasih dokter iman terima kasih,pelayanan,positif,9,7.454545454545454
5,bantu aplikasi lelah rumah bantu jelek aplikasi bagus,anekdot/serbaneka,positif,8,8.625
1,tangap lambat etik keluh dokter chat masuk pakai pangilan suara suara baik pakai bayar gratis,pelayanan,negatif,15,8.533333333333333
5,cangih obat keren cobain gratis bayar,anekdot/serbaneka,positif,7,6.875
5,kendala boking tes swab antigen klinik tutup operasial boking tes swab antigen tim cepat respon telepon konfirmasi dana masuk kordinasi klinik rumah sakit rekan tingkat sisa bagus terima kasih,pelayanan,positif,29,7.8125
5,pakai langsung puas semoga layan konsisten prima kepercayan terimakasih,anekdot/serbaneka,positif,11,9.0
4,layan jelek bayar mengunanakan debit kartu kendala opsi bayar,pelayanan,positif,9,9.666666666666666
1,dengar aplikasi bagus instal masuk aplikasi ngerespon,sistem,negatif,7,8.714285714285714
5,lumayan lengkap layan cepat aplikasi mudah bantu,sistem,positif,7,9.0
5,terima kasih kasih silfia mandasari respon cepat arah resep bantubagus,pelayanan,positif,9,8.1
5,bagus baik respon cepat akurat sukses,pelayanan,positif,6,7.333333333333332
5,mudah jelek rumah sakit obat,pelayanan,positif,5,8.2
5,layan dokter ramah baik cepat balas kes,pelayanan,positif,7,8.0
5,bantu situasi kondisi sukses bagus,anekdot/serbaneka,positif,4,7.333333333333332
1,pesan obat bayar batal bayar obat ratus ribu,pelayanan,negatif,8,7.75
1,dana uang telepon customer layan,pelayanan,negatif,5,9.0
1,konsultasi baik bagus konsultasi layan parah respon chat luama wktu menit habis saran klinik langsung curah hati kucing konsultasi cari solusi kucing aneh aneh bahasa sopan mangil saudara tolong seleksi rekrut dokter jelek layan jelek,pelayanan,negatif,34,8.2
4,customer pelayanan alami kendala telepon chat tim tolong,anekdot/serbaneka,positif,7,8.25
2,selesai bayar sukses potong saldo dokter sibuk dana butuh hitung masuk konfirmasi bank kait aduh otomatis dana masuk rekening konfirmasi bank sulit tolong mudah dana orang rumah bankbantu,sistem,negatif,30,8.806451612903226
5,sederhana aplikasi butuh medis pesan mudah cepat,anekdot/serbaneka,positif,7,8.571428571428571
1,kecewa daftar vaksin usia tolak alas mesti pakai ktp suket domisili vaksinasi suket domisili nama vaksin gratis warga negara indonesia semoga ulas hapus admin,pelayanan,negatif,25,7.9230769230769225
5,terima kasih gojek vaksinasi prambanan bagus layan suntik,pelayanan,positif,8,9.125
5,profesional bantu,anekdot/serbaneka,positif,2,11.5
5,bagus konsultasi dokter tatap muka,pelayanan,positif,5,8.0
5,konsultasi puas dokter bantu bantu,pelayanan,positif,5,8.6
5,manfaat cepat respon bagus,anekdot/serbaneka,positif,4,9.25
4,bantu konsultasi informasi kait sehat,pelayanan,positif,5,10.6
5,dokter anak cepat respon aplikasi bantu kondisi,pelayanan,positif,7,8.285714285714286
5,aplikasi bantu darurat terima kasih menunggu promo tarik,pelayanan,positif,7,9.571428571428571
5,bagus mudah konsultasi dokter spesialis,pelayanan,positif,5,10.0
5,aplikasi dokter keluarga sahabat jangkau jarak aplikasi sakit curi panik saldo gopay sederhana hub dokter informasi keluh bantu obat tunggu obat kirim instant beli gojek sunguh terobos manfaat era pandemi jarak dokter sukses bagus,anekdot/serbaneka,positif,36,8.555555555555555
1,dokter ngelewatin chat terima aju saldo ambil uang ambil konsultasi tolong customer layan keluh rugi jelas kecewa,pelayanan,negatif,18,8.61111111111111
2,kemarin kamis tanggal maret jam wita telepon mengatasnamakan customer servis dokter informasi fitur suruh aktivasi biaya paket rp auto debit bank informasi email aktif daftar percaya tuju informasi email email dana potong,anekdot/serbaneka,negatif,33,8.303030303030303
5,bantu konsultasi rumah kondisi covid,pelayanan,positif,5,9.0
1,parah vaksin usia dosis parah menunggu jam jelek antre heran vaksin lancar habis jelas buruk kasi orgtua vaksin baik aplikasi belah,pelayanan,positif,21,7.304347826086956
4,dokter luamayan alam fitur fitur bantu,pelayanan,positif,6,9.5
5,terima kasih bagus panik keluh bantu,anekdot/serbaneka,positif,5,8.6
2,instal daftarin vaksin usia tangal tulis slot sedia isi data upload ktp gilir submit penuh tulis auto recheck sedia slot resubmit penuh jelas baik,sistem,negatif,25,7.8076923076923075
5,bantu beli obat kota,pelayanan,positif,4,8.25
5,bantu mudah pasien keluarga layan sehat,pelayanan,positif,6,10.333333333333334
5,konsultasi muas rekomendasi rumah mobilitas semoga dokter dokter sehat bantu layan keluh pasien butuh rekomendasi,pelayanan,positif,16,10.625
5,kasih bintang semoga aplikasi layan baik,pelayanan,positif,6,8.5
5,bantu dokter bagus cepat respon,pelayanan,positif,5,8.0
5,puas layan lapang kait vaksin terima lancar cepat tugas ramah sabar penuh perhati terima kasih salam sehat bantu,pelayanan,positif,17,8.0
4,tolong kasih chat dokter bayar,pelayanan,negatif,5,8.2
5,konsultasi dokter hemat terimakasih,pelayanan,positif,4,9.75
5,baik situasi jam konsultasi,pelayanan,positif,5,8.6
5,senang langsung konsultasi dokter rumah,pelayanan,positif,5,10.2
1,janji sesuai jadwal sedia lab prodia mega galaxy sby maret jam pagi prodia tutup heran jadwal sedia aplikasi orang kecele chat bantu lambat respon jam solusi sms membatalkanatau mereschedul coba aplikasi aplikasi batal laku jam jadwal konsultasi reshedule jam jadwal konsultasi ampun ampun,pelayanan,negatif,43,8.116279069767442
5,semoga bantu pasien konsultasi rumah terima kasih,pelayanan,positif,7,8.571428571428571
5,pesan obat layan cepat respon langsung kirim darurat,pelayanan,positif,8,8.375
5,suka aplikasi bantu layan bagus case kirim barang langsung kirim sok sukses tingkat layan,pelayanan,positif,15,9.066666666666666
5,tolong tolong kucing bantu bagus,pelayanan,positif,5,9.6
5,dokter ramah baik layan bijaksna terima kasih,pelayanan,positif,7,8.0
5,terima kasih vaksin covid efek signifikan,anekdot/serbaneka,positif,6,8.0
5,bagus bantu urus sehat jam,pelayanan,positif,5,8.2
5,bagus pakai aplikasi cari obat harga jangkau,harga,positif,7,8.142857142857142
5,keren cepat respon konsultasi dokter kandung,pelayanan,positif,6,8.833333333333334
5,kasih bintang kasih aplikasi baik beli butuh medis darurat rumah bagus masuk jelek semoga apotek aplikasi jarak ambil obat bagus,pelayanan,positif,20,8.25
5,puas konsultasi dokter papua susah nebus obat jelek nunjukin chat obat untung tanda tangan,pelayanan,negatif,14,7.642857142857142
2,niat instal aplikasi mudah beli obat kondisi sakit kos beli estimasi aplikasi cocok kondisi darurat beli obat orang sakit parah lanjur wasalam obat edit ulas aplikasi baik sistem,sistem,negatif,28,8.25
3,selamat siang salam telepon nama biaya klaim aktif biaya nomor rek sistem potong ribu mohon konfirmasi takut saldo tepotong terima kasih,anekdot/serbaneka,positif,24,8.333333333333334
5,bantu pandemi terima kasih,anekdot/serbaneka,positif,3,10.666666666666666
4,konsultasi dokter nyaman keluh foto langsung area sakit dokter detail semoga resep cocok keluh terima kasih dokter,pelayanan,positif,17,8.055555555555555
5,praktis bagus dokter keluh terima kasih,pelayanan,positif,5,7.666666666666668
5,terima kasih aplikasi percaya chat langsung bagus,pelayanan,positif,6,8.285714285714286
3,coba kaji vaksin mitra ojol sejati mitra pakai ojol cari rezeki gojek grab indriver maxim wajib vaksin mitran repot batalin kerja vaksin biar mitra vaksin aparatur perintah,anekdot/serbaneka,negatif,27,7.592592592592593
5,dokter anak bayi usia anak rawat rumah sakit hasil rongsen idap sakit radang paru tolong dokter anak sembuh total sakit terima kasih bantu,anekdot/serbaneka,positif,22,7.863636363636362
5,respon baik dokter terima kasih,pelayanan,positif,5,7.4
5,aplikasi terima kasih giat vaksin serentak prambanan sleman terima kasih perintah diy yogyakarta sponsor giat semoga giat pahala limpah tuhan maha esa terima kasih baik regard beny,pelayanan,positif,30,8.733333333333333
2,posisi ambil obat rumah tunggu,pelayanan,negatif,5,8.8
1,janji buka jam dokter balas balas batal tulis aplikasi daring kecewa unduh butuh donasi menu donasi pilih bayar saldo layan banding aplikasi belah,pelayanan,negatif,25,8.88
1,klg periksa pacar hasil periksa tanggal maret jam drive thru mayor tanggal maret jam hasil butuh hasil cepat layan pemeriksan covid turun periksa gratis,pelayanan,negatif,25,7.8
5,alam bagus konsultasi dokter pilih,pelayanan,positif,5,9.6
1,mohon maaf kasih bintang jelek layan pesan vitamin tangal estimasi tangal proses tolong customer pelayanan telepon chat cek cek cek batal pesan beli pasar saldo tarik rekening tolong tingkat layan tolong kirim pesan,pelayanan,negatif,32,8.030303030303031
5,bantu terima kasih dokter aplikasi bantu,pelayanan,positif,6,8.333333333333334
5,mudah konsultasi dokter temu langsung,pelayanan,positif,5,10.2
5,konsultasi keluh mudah sulit antre rumah sakit,pelayanan,positif,7,8.0
1,dokter gratis,pelayanan,negatif,2,8.0
5,tolong zaman covid takut rumah sakit konsultasi hewan peliharan konsultasi gigi tolong terima kasih,pelayanan,positif,14,8.571428571428571
5,jelas dokter lengkap ramah terima kasih,pelayanan,positif,5,8.166666666666666
5,baik andal suka,anekdot/serbaneka,positif,3,9.0
5,malam malam sakit binggung keluh obat langsung jelek kendala kirim kadang driver kontak langsung tepo,pelayanan,negatif,17,8.222222222222221
5,jelas daring pilih aman,pelayanan,positif,4,7.5
5,bantu transaksi biaya mudah,harga,negatif,4,9.5
5,cakap dokter jelas arah bagus,pelayanan,positif,5,8.4
5,vaksin tanggal maret daftar vaksin kode kupon kirim urus terima kasih,anekdot/serbaneka,positif,11,7.545454545454546
5,bantu konsultasi langsung dokter,pelayanan,positif,4,10.0
5,bagus dokter susah mahal bagus,harga,positif,5,7.2
2,bayar dokter sibuk chat ulang gubris nyapa bilang dokter sibuk gopay potong dana mohon dibanding dokter gubris baik lapor sibuk coba berani daftar risiko nerima permintan konsultasi pasien diemin binggung dana fleksibel jam respon sesi bayar hak pasien makan gaji buta chat diam diam baik,pelayanan,negatif,48,8.02
1,tangal maret saldo anjung tunai mandiri ambil program adakan kemarin telepon mengatasnamakan customer pelayanan rugi henti henti langgan,pelayanan,negatif,15,8.777777777777779
1,transaksi gagal saldo potong lihat riwayat transaksi,sistem,negatif,7,9.0
2,layan proses cepat catat pasien status gejala covid dokter kasih himbauan asih pil tidur sesuai dosis orsng sakit butuh istirahat,pelayanan,positif,21,8.0
4,beli obat layan dokter bagus ganguan ganti nomor nomor ganti pakai email riwayat transaksi hilang jelek aplikasi,pelayanan,negatif,17,7.882352941176472
5,senang aplikasi cepat respon obat langsung resep layan jam dokter baik informatif terima kasih,pelayanan,positif,15,8.133333333333333
1,bayar luas gopay bca mandiri debit maksud ragu cobain aplikasi dokter langsung pandemi bayar indomaret alfamart kota akses mudah desa susah inti tingkat mohon,sistem,negatif,26,8.071428571428571
5,bantu usia biaya sehat batas,anekdot/serbaneka,positif,5,8.333333333333334
5,konsultasi dokter jelek line mudah pilih dokter kisar biaya sesuai terima kasih,pelayanan,positif,12,9.0
4,aplikasi bantu kalang luas batas khusus milenial konsultasi tipis tipis saran muculkan saldo profile milik akun mudah isi saldo bank aplikasi bayar bayar,sistem,positif,24,8.458333333333334
5,bantu pandemi,anekdot/serbaneka,positif,2,9.5
5,manfaat orang butuh bantu cepat,anekdot/serbaneka,positif,5,9.6
5,cangih langsung konsultasi dokter ahli rumah sakit respon cepat dokter bantu butuh layan sehat,pelayanan,positif,14,9.0
1,janji rapid tutup,anekdot/serbaneka,negatif,3,7.0
1,aplikasi ambil antre daring aplikasi terintegras dita hasil cek upaya lapor lapor lapor lapor sehat sulit expetasi tuju utama boh fair slogan customer klinik bolak hasil test pakai daring,pelayanan,negatif,31,7.875
5,semenjak bantu konsultasi beli obat rumah antre rumah sakit apotek bagus diskon sesi konsultasi dokter makas mudah hidup semoga promo sukses bagus,pelayanan,positif,22,8.090909090909092
1,alami kesal daftar vaksinasi usia hubung usia janji tangal vaksinasi batal,pelayanan,negatif,11,9.0
1,aplikasi jelek aktivasi lambat klik,sistem,negatif,6,8.666666666666666
5,puas bagus ulas cocok ramah cocok obat,pelayanan,positif,7,6.857142857142858
5,terima kasih konsultasi bantu,pelayanan,positif,4,9.25
5,layan mudah obat keliling apotek lengkap solusi baik lengkap obat terima kasih,pelayanan,positif,12,8.916666666666666
5,bantu pesan obat darurat butuh sedih histori jalan paket obat kaya tunggu update terima kasih tim cepat respon jelas bantu,pelayanan,negatif,19,7.75
5,manfaat anak sakit malam rumah sakit jelek chat dokter aplikasi beres pandemi terima kasih bantu dokter terima kasih aplikasi,anekdot/serbaneka,positif,16,7.7894736842105265
5,bagus cepat konsultasi terima kasih,pelayanan,positif,4,7.8
5,dokter kamar pisah pakai isolasi mandiri angota keluarga kena covid sembuh kamar steril pakai masuk kamar,anekdot/serbaneka,positif,16,8.5625
3,aplikasi buka,sistem,negatif,3,10.0
5,aplikasi manfaat beli obat,pelayanan,positif,4,9.75
5,dokter bagus informasi jelas tolong,pelayanan,positif,5,8.6
5,senang obat konsultasi doktet shanti tandayu internist ramah jelas tele obat arah bagus isk baik terima kasih manfaat bagus,pelayanan,positif,19,8.263157894736842
3,driver gojek kemarin pesan vaksin covid bawa orang usia vaksin bawa orang usia,anekdot/serbaneka,positif,13,7.133333333333334
5,aplikasi bantu pandemi covid rumah tingal aplikasi terima kasih tingkat kualitas,anekdot/serbaneka,positif,11,8.833333333333334
5,janji dokter vaksin manula drive thru mudah terima kasih,pelayanan,positif,8,7.111111111111112
5,partisipasi penangulangan covid,anekdot/serbaneka,positif,3,12.666666666666664
5,bantu muas informasi layan,pelayanan,positif,4,10.75
5,kasih bintang kendala bayar gopay selesai tim cepat bantu terima kasih tim bagus,sistem,positif,12,8.076923076923077
5,untung aplikasi antre antre rumah sakit klinik obat obat rekomendasi manjur,pelayanan,positif,10,8.272727272727273
3,vaksin sertifikat vaksin admin,anekdot/serbaneka,positif,4,8.75
5,aplikasi bagus layan konsultasi cepat respon apotek cepat,pelayanan,positif,8,8.75
5,pesan obat fitur chat tolong alih fitur sms butuh pulsa alih fitur gojek fitur chat aplikasi konfirmasi driver pakai pulsa,sistem,negatif,20,7.85
5,dokter ramah diskusi bagus lancar salut sangka bagus jam obat,pelayanan,positif,11,7.454545454545454
1,asli parah aplikasi niat cepat urus rapid antigen kendala aplikasi sia sia harap harap berangkat kerja parah dana,pelayanan,negatif,19,8.578947368421053
5,aplikasi konsultasi dokter manfaat kondisi keluh salah diagnosis,pelayanan,positif,8,9.75
5,cepat hemat efesien janji vaksinasi covid usia aplikasi bantu tingal janji vaksinasi sukses amanah bagus,pelayanan,positif,15,8.0625
5,terima kasih pandemi aman kesini konsultasi dokter senior langgan terima kasih,pelayanan,positif,11,8.181818181818182
4,bagus kadang obat sedia apotek pesan daring semoga baik,pelayanan,negatif,11,7.25
1,sumpah chat dokter pakai bayar enga aplikasi bantu orang susah konsultasi bayar kecuali beli obat periksa bagus chat bayar bantu,pelayanan,negatif,20,7.75
5,manfaat aplikasi,anekdot/serbaneka,positif,2,11.0
1,aplikasi jalan respon sebal,sistem,negatif,4,9.5
5,konsultasi muas pergi apotek terima kasi aplikasi semoga manfat,pelayanan,positif,10,8.7
5,bagus aplikasi respon dokter baik,pelayanan,positif,5,7.8
5,terima kasih bantu darurat libur terima kasih dokter stand beli libur chat asik ramah informasi akurat,pelayanan,positif,14,8.428571428571429
5,informasi mudah,pelayanan,positif,3,9.333333333333334
1,aplikasi bayar aplikasi bagus cobain lihat download bagus download bayar langsung kecewa tolong kembang biar aplikasi bayar gratis aplikasi belah kasih bintang fitur dokter gratis kasih bintang,anekdot/serbaneka,negatif,27,8.74074074074074
1,bantu apan jelas sulit bayar sulit aplikasi sumpah hack aplikasi sumpah janji rapid sulit,pelayanan,negatif,15,7.933333333333334
5,efesien pesan obat cari apotek sedia obat suka suka kembang,pelayanan,positif,12,8.5
5,bantu layan ramah bagus dokter,pelayanan,positif,5,8.6
5,puas dokter dokter baik ramah ramah diaknosa obat bagus cocok semoga dokter sehat amin,pelayanan,positif,14,7.2142857142857135
5,kirim ramah sesuai pesan salut drivernya,pelayanan,positif,6,8.666666666666666
5,bantu pandemi konsultasi obat rumah serasa dokter pribadi,pelayanan,positif,9,8.555555555555555
2,asalamualaikum maaf habis unduh aplikasi playstore buka aplikasi masuk aplikasi klik chat dokter lihat situ pilih dokter chat konsultasi sehat konsultasi sehat dokter aplikasi bayar chat konsultasi dokter chat,anekdot/serbaneka,positif,30,8.483870967741936
5,solusi praktis biaya murah dokter responsif,harga,positif,6,8.333333333333334
1,daring sesi konsultasi beli teks telepon buang buang uang bayar konsultasi,harga,negatif,12,8.0
1,uang terima status tes antigen konfirmasi konfirmasi nerima uang layan customer respon lancar lancar kecewa berat,pelayanan,negatif,16,8.5
5,aplikasi bantu keluarga beli obat obat vitamin tes pacar pandemi bagus,pelayanan,positif,11,8.181818181818182
1,aplikasi bagus scheduling dokter antre rumah sakit layan kecewa hasil tes informasi sms selesai hasil tes hardcopy softcopy ambil tes media chat customer pelayanan respon lambat respon menit putus jalur komunikasi ulang respon lambat customer pelayanan konfirmasi konfirmasi kait arti sla sisi responsif,pelayanan,negatif,41,8.159090909090908
5,dokter responsif nyaman konsultasi terima kasih,pelayanan,positif,5,8.666666666666666
5,bantu sulit rumah,anekdot/serbaneka,positif,3,8.0
5,keren aplikasi bantu darurat khusus terima kasih fen ramah konsultasi resep cocok,pelayanan,positif,12,8.083333333333334
1,iwan setiawan ag salah driver gojek bandar lampung konfirmasi pemesanan apotek jesaya farma pemesanan ambil obat harap tunggu barang obat pesan sedia aplikasi gojek jalan pesan gojek barang driver tingal bawa barang jalan pemesanan dasar konfirmasi pelang apotek,anekdot/serbaneka,negatif,39,8.794871794871796
2,niat make aplikasi cepat rumah nyata apotek apotek bumn swasta diskitar fitur ngebuat pembeliatau driver milih apotek pakai manual nahan sakit posisi kota,pelayanan,negatif,24,7.833333333333332
1,chat bayar baik pakai bagus google gratis,pelayanan,negatif,7,7.125
5,aplikasi bantu metode bayar tambahin harga baik tingkat sukses terima kasih,pelayanan,negatif,12,9.166666666666666
